Guideline,Description
3.1.2 Language of Parts,"If the human language of a part of the page changes, the language should be able to be programmatically determined"
3.2.3 Consistent Navigation,Navigation components like a navigation bar or search bar should be consistent across other pages
3.2.4 Consistent Identification,Components that work the same across pages should be identified the same on each page
3.3.3 Error Suggestion,If an error can be detected along with the reason for the error it should be stated to user unless that error would compromise security or purpose of the content
3.3.4 Error Prevention,"If content has a legal commitment or a financial transaction, it should either have reversible submissions, a way to check the data being entered, or a way to confirm information before it is finalized."
3.3.8 Accessible Authentication (Minimum) (New to 2.2),A cognitive test such as remembering a password is not required in any step for authentication. An example of this is allowing the use of a password manager or allowing email authentication. 